{
  "source": {
    "id": "public-apis-4kr",
    "name": "public-apis-4Kr (한국 공개 API 목록)",
    "url": "https://github.com/yybmion/public-apis-4Kr",
    "license": "MIT (list text); each API has its own terms",
    "note": "Every row of the Korean README tables. Rows that duplicate an entry of the hand-checked list (official.json) are skipped. metrics.siteRank = global Chrome UX Report rank bucket of the item's site (1000, 5000, 10000, 50000, 100000, 500000, 1000000; Chrome UX Report top lists (CC BY 4.0, via github.com/zakird/crux-top-lists), 2026-10), set only when the item has no other metric. Used only for sorting."
  },
  "fetchedAt": "2026-10-20",
  "count": 296,
  "items": [
    {
      "id": "public-apis-4kr:adstat.kobaco.co.kr",
      "name": "방송통신광고 통계시스템",
      "kind": "kr-public",
      "category": "api",
      "summary": "방송통신광고 통계",
      "url": "https://adstat.kobaco.co.kr/",
      "source": {
        "name": "public-apis-4Kr",
        "url": "https://github.com/yybmion/public-apis-4Kr"
      },
      "tags": [
        "auth-website",
        "korea",
        "통계-지표"
      ],
      "preview": {
        "type": "api",
        "auth": "website",
        "listCategory": "통계 & 지표"
      },
      "fetchedAt": "2026-10-20"
    },
    {
      "id": "public-apis-4kr:aihub.or.kr",
      "name": "AI Hub",
      "kind": "kr-public",
      "category": "api",
      "summary": "한국어, 이미지, 음성, 헬스케어 등 AI 학습용 데이터셋",
      "url": "https://aihub.or.kr",
      "source": {
        "name": "public-apis-4Kr",
        "url": "https://github.com/yybmion/public-apis-4Kr"
      },
      "tags": [
        "auth-login",
        "korea",
        "데이터셋-데이터-포털"
      ],
      "preview": {
        "type": "api",
        "auth": "Login",
        "listCategory": "데이터셋 & 데이터 포털"
      },
      "fetchedAt": "2026-10-20",
      "metrics": {
        "siteRank": 500000
      }
    },
    {
      "id": "public-apis-4kr:airbnb.com-help-article-3418",
      "name": "Airbnb API",
      "kind": "kr-dev",
      "category": "api",
      "summary": "숙소 관리, 예약 관리 (B2B 파트너십 필수)",
      "url": "https://www.airbnb.com/help/article/3418",
      "source": {
        "name": "public-apis-4Kr",
        "url": "https://github.com/yybmion/public-apis-4Kr"
      },
      "tags": [
        "auth-oauth",
        "korea",
        "부동산"
      ],
      "preview": {
        "type": "api",
        "auth": "OAuth",
        "listCategory": "부동산"
      },
      "fetchedAt": "2026-10-20",
      "metrics": {
        "siteRank": 5000
      }
    },
    {
      "id": "public-apis-4kr:airport.co.kr-www-cms-frcon-index.do-menu-id-1270",
      "name": "한국공항공사(KAC) Open API",
      "kind": "kr-public",
      "category": "api",
      "summary": "김포·김해·제주 등 14개 국내공항 통합 OpenAPI (운항·주차·소음·상업시설)",
      "url": "https://www.airport.co.kr/www/cms/frCon/index.do?MENU_ID=1270",
      "source": {
        "name": "public-apis-4Kr",
        "url": "https://github.com/yybmion/public-apis-4Kr"
      },
      "tags": [
        "auth-apikey",
        "korea",
        "항공"
      ],
      "preview": {
        "type": "api",
        "auth": "apiKey",
        "listCategory": "항공"
      },
      "fetchedAt": "2026-10-20",
      "metrics": {
        "siteRank": 500000
      }
    },
    {
      "id": "public-apis-4kr:alimi.or.kr-dataview-a-selectareainterest.do",
      "name": "농어촌알리미",
      "kind": "kr-public",
      "category": "api",
      "summary": "지역 농업·농어촌 지표",
      "url": "https://www.alimi.or.kr/dataview/a/selectAreaInterest.do",
      "source": {
        "name": "public-apis-4Kr",
        "url": "https://github.com/yybmion/public-apis-4Kr"
      },
      "tags": [
        "auth-website",
        "korea",
        "통계-지표"
      ],
      "preview": {
        "type": "api",
        "auth": "website",
        "listCategory": "통계 & 지표"
      },
      "fetchedAt": "2026-10-20"
    },
    {
      "id": "public-apis-4kr:alldam.chungnam.go.kr",
      "name": "충남 데이터포털 올담",
      "kind": "kr-public",
      "category": "api",
      "summary": "충청남도 공공데이터",
      "url": "https://alldam.chungnam.go.kr",
      "source": {
        "name": "public-apis-4Kr",
        "url": "https://github.com/yybmion/public-apis-4Kr"
      },
      "tags": [
        "auth-apikey",
        "korea",
        "지역별-공공데이터"
      ],
      "preview": {
        "type": "api",
        "auth": "apiKey",
        "listCategory": "지역별 공공데이터"
      },
      "fetchedAt": "2026-10-20"
    },
    {
      "id": "public-apis-4kr:api.bus.go.kr-contents-sub01-wisopenapi.html",
      "name": "서울시 버스 도착정보",
      "kind": "kr-public",
      "category": "api",
      "summary": "서울시 시내버스 실시간 도착정보",
      "url": "http://api.bus.go.kr/contents/sub01/wisOpenApi.html",
      "source": {
        "name": "public-apis-4Kr",
        "url": "https://github.com/yybmion/public-apis-4Kr"
      },
      "tags": [
        "auth-apikey",
        "korea",
        "교통"
      ],
      "preview": {
        "type": "api",
        "auth": "apiKey",
        "listCategory": "교통"
      },
      "fetchedAt": "2026-10-20"
    },
    {
      "id": "public-apis-4kr:api.dbpia.co.kr-openapi-index.do",
      "name": "DBpia API",
      "kind": "kr-dev",
      "category": "api",
      "summary": "학술논문 검색 (기관 라이선스)",
      "url": "https://api.dbpia.co.kr/openApi/index.do",
      "source": {
        "name": "public-apis-4Kr",
        "url": "https://github.com/yybmion/public-apis-4Kr"
      },
      "tags": [
        "auth-apikey",
        "korea",
        "과학-연구"
      ],
      "preview": {
        "type": "api",
        "auth": "apiKey",
        "listCategory": "과학 & 연구"
      },
      "fetchedAt": "2026-10-20",
      "metrics": {
        "siteRank": 50000
      }
    },
    {
      "id": "public-apis-4kr:api.ncloud-docs.com-docs-common-ncpapi",
      "name": "네이버 클라우드 플랫폼",
      "kind": "kr-dev",
      "category": "api",
      "summary": "종합 클라우드 서비스 (AI, Maps, SMS, Object Storage)",
      "url": "https://api.ncloud-docs.com/docs/common-ncpapi",
      "source": {
        "name": "public-apis-4Kr",
        "url": "https://github.com/yybmion/public-apis-4Kr"
      },
      "tags": [
        "auth-apikey",
        "korea",
        "클라우드-서비스"
      ],
      "preview": {
        "type": "api",
        "auth": "apiKey",
        "listCategory": "클라우드 서비스"
      },
      "fetchedAt": "2026-10-20"
    },
    {
      "id": "public-apis-4kr:api.visitkorea.or.kr",
      "name": "한국관광공사 TourAPI 4.0",
      "kind": "kr-public",
      "category": "api",
      "summary": "관광지, 숙박, 음식점, 축제 등 관광정보",
      "url": "https://api.visitkorea.or.kr/",
      "source": {
        "name": "public-apis-4Kr",
        "url": "https://github.com/yybmion/public-apis-4Kr"
      },
      "tags": [
        "auth-apikey",
        "korea",
        "문화-관광"
      ],
      "preview": {
        "type": "api",
        "auth": "apiKey",
        "listCategory": "문화 & 관광"
      },
      "fetchedAt": "2026-10-20"
    },
    {
      "id": "public-apis-4kr:apicenter.commerce.naver.com-ko-basic-commerce-api",
      "name": "네이버 커머스 API",
      "kind": "kr-dev",
      "category": "api",
      "summary": "스마트스토어 판매자 전용 상품/주문 관리",
      "url": "https://apicenter.commerce.naver.com/ko/basic/commerce-api",
      "source": {
        "name": "public-apis-4Kr",
        "url": "https://github.com/yybmion/public-apis-4Kr"
      },
      "tags": [
        "auth-oauth",
        "korea",
        "쇼핑-이커머스"
      ],
      "preview": {
        "type": "api",
        "auth": "OAuth",
        "listCategory": "쇼핑 & 이커머스"
      },
      "fetchedAt": "2026-10-20"
    },
    {
      "id": "public-apis-4kr:apidocs.bithumb.com",
      "name": "빗썸 프로 API",
      "kind": "kr-dev",
      "category": "api",
      "summary": "전문 거래자용 암호화폐 거래 API",
      "url": "https://apidocs.bithumb.com/",
      "source": {
        "name": "public-apis-4Kr",
        "url": "https://github.com/yybmion/public-apis-4Kr"
      },
      "tags": [
        "auth-apikey",
        "korea",
        "암호화폐-거래소"
      ],
      "preview": {
        "type": "api",
        "auth": "apiKey",
        "listCategory": "암호화폐 거래소"
      },
      "fetchedAt": "2026-10-20"
    },
    {
      "id": "public-apis-4kr:apihub.kma.go.kr",
      "name": "기상청 API허브",
      "kind": "kr-public",
      "category": "api",
      "summary": "관측·예보·위성·레이더 등 12개 분야 기상데이터",
      "url": "https://apihub.kma.go.kr/",
      "source": {
        "name": "public-apis-4Kr",
        "url": "https://github.com/yybmion/public-apis-4Kr"
      },
      "tags": [
        "auth-apikey",
        "korea",
        "날씨-환경"
      ],
      "preview": {
        "type": "api",
        "auth": "apiKey",
        "listCategory": "날씨 & 환경"
      },
      "fetchedAt": "2026-10-20",
      "metrics": {
        "siteRank": 1000000
      }
    },
    {
      "id": "public-apis-4kr:apilink.kt.co.kr",
      "name": "KT API Link",
      "kind": "kr-dev",
      "category": "api",
      "summary": "Geo Master, Cloud API, GiGA Genie AI",
      "url": "https://apilink.kt.co.kr/",
      "source": {
        "name": "public-apis-4Kr",
        "url": "https://github.com/yybmion/public-apis-4Kr"
      },
      "tags": [
        "auth-apikey",
        "korea",
        "통신사"
      ],
      "preview": {
        "type": "api",
        "auth": "apiKey",
        "listCategory": "통신사"
      },
      "fetchedAt": "2026-10-20"
    },
    {
      "id": "public-apis-4kr:apiportal.kbfg.com",
      "name": "KB API 포탈",
      "kind": "kr-dev",
      "category": "api",
      "summary": "KB금융그룹 종합 금융 API 서비스 (800+ API 제공)",
      "url": "https://apiportal.kbfg.com/",
      "source": {
        "name": "public-apis-4Kr",
        "url": "https://github.com/yybmion/public-apis-4Kr"
      },
      "tags": [
        "auth-oauth",
        "korea",
        "금융-결제"
      ],
      "preview": {
        "type": "api",
        "auth": "OAuth",
        "listCategory": "금융 & 결제"
      },
      "fetchedAt": "2026-10-20"
    },
    {